{
  "feature_id": "2026-04-26-aip-skill-command-router",
  "status": "done",
  "current_phase": "done",
  "current_task": "Add parameterized aip skill commands completed.",
  "next_action": "Pull the latest repository and reinstall with python scripts/install_codex_plugin.py --force to use $aip command routing.",
  "last_updated": "2026-04-26T22:53:11+08:00",
  "owner": "ai",
  "blocking": [],
  "must_read": [
    "project_docs/protocols/ai-implementation-protocol.md",
    "project_docs/features/2026-04-26-aip-skill-command-router/spec.md",
    "project_docs/features/2026-04-26-aip-skill-command-router/plan.md",
    "project_docs/features/2026-04-26-aip-skill-command-router/handoff.md",
    "project_docs/features/2026-04-26-aip-skill-command-router/verification.md"
  ]
}
